id,external_id,title,department,location,state,city,job_type,salary_min,salary_max,posted_date,url,description,qualifications,scraped_at,unique_key,company_name,subdomain,portal_slug,sector,ats_type
260781,31106618,＜診断薬・機器事業部＞ Field Service Engineer（全国オープンポジション）,,Japan - Osaka,,,Full time,,,2026-03-25T00:00:00,https://abbott.wd5.myworkdayjobs.com/abbottcareers/job/Japan---Osaka/XMLNAME----31105941-Field-Service-Engineer----_31106618,"JOB DESCRIPTION: 勤務地：全国 ※採用ポジションの有無やご希望を踏まえ、配属先はご相談のうえ決定いたします。 About Abbott Abbott is a global healthcare leader, creating breakthrough science to improve people’s health. We’re always looking towards the future, anticipating changes in medical science and technology. Working at Abbott At Abbott, you can do work that matters, grow, and learn, care for yourself and family, be your true self and live a full life. You will have access to: Career development with an international company where you can grow the career you dream of. A company recognized as a great place to work in dozens of countries around the world and named one of the most admired companies in the world by Fortune. A company that is recognized as one of the best big companies to work for as well as a best place to work for diversity, working mothers, female executives, and scientists. We’re empowering smarter medical and economic decision making to help transform the way people manage their health at all stages of life. Every day, more than 10 million tests are run on Abbott’s diagnostics instruments, providing lab results for millions of people. 【業務内容】 臨床医療における診断・検査に不可欠な診断機器のメンテナンス業務となります。 アボットは臨床検査の分野では、癌やHIV・C型肝炎ウイルスなどの感染症やホルモン・甲状腺関連の診断薬を開発、提供するなど、幅広い事業領域で高い評価を得ています。 世界基準に照応したアボット ジャパンは世界から日本に、そして日本から世界へ、最先端の技術・製品・情報交流の重要な役割を担っています。 <具体的業務内容> ・機器の修理 ・定期点検 ・機器の設置 ・機器の改良、変更作業 ・保守契約の交渉、締結 ・保守部品の管理 <訪問先> 国公立病院・民間主要病院の検査室、日本赤十字社、臨床検査センターなど。 ※1日の訪問件数は1～2件程度。 ※訪問先に直行または直帰の場合も有り。 【応募条件】 ・機器メンテナンスまたはフィールドサービスの分野における3年以上の実務経験および知識 ・第一種普通自動車免許 ・PCスキル（Excel、Word、PowerPoint） ・医療機器業界での経験者優遇 Follow your career aspirations to Abbott for diverse opportunities with a company that can help you build your future and live your best life. Abbott is an Equal Opportunity Employer, committed to employee diversity. Connect with us at www.abbott.com , on Facebook at www.facebook.com/Abbott and on Twitter @AbbottNews and @AbbottGlobal. The base pay for this position is N/A In specific locations, the pay range may vary from the range posted. JOB FAMILY: Field Services DIVISION: LOCATION: Japan > Osaka : 1-1-6 Bingo-machi ADDITIONAL LOCATIONS: WORK SHIFT: Standard TRAVEL: Not specified MEDICAL SURVEILLANCE: Not Applicable SIGNIFICANT WORK ACTIVITIES: Not Applicable",,2026-03-25T07:30:47.444911,68b7f627fcc3c6c5,ABBOTT,abbott,abbott,,workday
227321,330203,"Director, Hyperscale Data Center Security Operations",,"TX, United States",,,,,,2026-03-24T00:00:00,https://eeho.fa.us2.oraclecloud.com/hcmUI/CandidateExperience/en/sites/CX_1/job/330203,,,2026-03-25T07:16:24.045630,e05855cfe12ed8bc,Oracle (EEHO),eeho,eeho,,oracle
227320,330124,Principal Member of Technical Staff - US Citizenship Required,,United States,,,,,,2026-03-24T00:00:00,https://eeho.fa.us2.oraclecloud.com/hcmUI/CandidateExperience/en/sites/CX_1/job/330124,,,2026-03-25T07:16:24.045615,df3d53e29e787232,Oracle (EEHO),eeho,eeho,,oracle
227319,330119,Senior Software Engineer (IC3) - US Citizenship Required,,United States,,,,,,2026-03-24T00:00:00,https://eeho.fa.us2.oraclecloud.com/hcmUI/CandidateExperience/en/sites/CX_1/job/330119,,,2026-03-25T07:16:24.045599,176fd44da970783c,Oracle (EEHO),eeho,eeho,,oracle
227317,330114,Senior Clinical Consultant - Cerner Millennium,,United States,,,,,,2026-03-24T00:00:00,https://eeho.fa.us2.oraclecloud.com/hcmUI/CandidateExperience/en/sites/CX_1/job/330114,,,2026-03-25T07:16:24.045568,266df870ab79a184,Oracle (EEHO),eeho,eeho,,oracle
227316,330113,Federal Project Manager II - Oracle Health (EHR Pre & Post Go-live Readiness),,United States,,,,,,2026-03-24T00:00:00,https://eeho.fa.us2.oraclecloud.com/hcmUI/CandidateExperience/en/sites/CX_1/job/330113,,,2026-03-25T07:16:24.045552,4fcc9534abaf86a2,Oracle (EEHO),eeho,eeho,,oracle
227314,329816,Federal Program Cost Control Analyst I - Oracle Health Government Services -  Must work in office Arlington VA,,"Arlington, VA",,,,,,2026-03-24T00:00:00,https://eeho.fa.us2.oraclecloud.com/hcmUI/CandidateExperience/en/sites/CX_1/job/329816,,,2026-03-25T07:16:24.045521,5e2764ee62c9ac2d,Oracle (EEHO),eeho,eeho,,oracle
227313,325964,Electrical Engineer - Power Systems Engineer,,United States,,,,,,2026-03-24T00:00:00,https://eeho.fa.us2.oraclecloud.com/hcmUI/CandidateExperience/en/sites/CX_1/job/325964,,,2026-03-25T07:16:24.045505,ba9fe8d4cf5f4de6,Oracle (EEHO),eeho,eeho,,oracle
227312,325963,Electrical Engineer - Power Systems Engineer,,United States,,,,,,2026-03-24T00:00:00,https://eeho.fa.us2.oraclecloud.com/hcmUI/CandidateExperience/en/sites/CX_1/job/325963,,,2026-03-25T07:16:24.045489,914d336ab6544195,Oracle (EEHO),eeho,eeho,,oracle
227311,321285,"Physician, Pediatric Cardiac Intensivist (Full-Time)",Physician Group,,,,Full-time,300000.0,310000.0,2026-03-24T00:00:00,https://memorialcare.taleo.net/careersection/phy/jobdetail.ftl?job=321285,"Pediatric Cardiac Intensivist MemorialCare Miller Children’s & Women’s Hospital of Long Beach MemorialCare Medical Group Base Salary Range*: $300,000 to $310,000 *The salary range above is an estimated annual base salary for a full-time position. Your Total Rewards would include a base salary plus performance-based incentives and other valuable benefits. Our compensation models utilize fair market value data specific to your specialty. Memorial Care Medical Group (MCMG) is looking for a Pediatric Cardiac Intensivist for our dedicated Pediatric Cardiothoracic Intensive Care Unit (CTICU) at Miller Children’s & Women’s Hospital of Long Beach (MCWHLB). The new state of the art 8-bed CTICU and an additional 6-bed stepdown unit are part of our Heart Institute’s rapid growth to serve the needs of the southern California community. Candidates with strong clinical and teaching skills are encouraged to apply. The candidate should be board-certified in Pediatric Critical Care plus advanced fellowship training in Pediatric Cardiac Critical Care or a record of excellence in the clinical care of congenital cardiac patients. The successful candidate will work closely with the CTICU Medical Director Dr. Constantinos Chrysostomou and a multidisciplinary team of pediatric cardiac intensivists, cardiac surgeons, cardiologists, dedicated CTICU nurses and other specialists to further develop a state-of-the-art clinical program. Successful candidates should have (or be eligible for) an unrestricted California medical license. As part of the Memorial Care Medical Group, you will be given the tools you need to build the career you want, and the flexibility to adapt as your personal needs and professional interests change. We invite you to grow with us and help shape the future of this community. Robust compensation and benefits package are provided. Memorial Care Miller Children’s & Women’s Hospital of Long Beach, is a private, not for profit children’s hospital first opened in 1970. It is a 324 bed children’s hospital that treats more than 8,000 children each year and has become a regional pediatric destination for more than 84,000 children. It has an active perinatal and maternal fetal medicine service with over 7000 deliveries annually to the adjacent birth center and one of the largest Neonatal Intensive Care units (NICU) in the area with over 90 beds. The hospital serves as the major referral center for the over 500,000 people of Long Beach, but reaches an additional 2 million people in the immediate vicinity. The hospital has an academic affiliation with the University of California Los Angeles (UCLA) and the University of California Irvine (UCI) to which the successful candidate is eligible to apply for a faculty position. Financial & Benefits • Employed position with MemorialCare Medical Group • Competitive salary with incentive compensation • Eligible to be considered for Shareholder/Partner status with MCMG after two years of full-time employment • Full and comprehensive benefits for Physician and family • 401(k) retirement plan with employer matching • 529 College Savings Plan About Long Beach and Southern California Located on the coast of the Pacific Ocean south of Los Angeles and just west of Orange County, Long Beach is the sixth largest city in the State of California. Offering all the world class amenities of a large metropolitan city, coupled with its strong sense of community and pride, Long Beach is one of the most vibrant communities in the country. The city has been referred to as the ""Most Diverse City"" in the country by USA Today and one of the ""Best Communities for Young People"" two years in a row. With its ideal location in Southern California, year-round comfortable climate, healthy business environment and far ranging cultural pursuits, the city is alive with activity. Long Beach is home to an abundance of cultural and recreational options. Expansive beaches, three marinas, five golf courses, the Aquarium of the Pacific, the Queen Mary and the annual Grand Prix of Long Beach serve to draw 6.5 million visitors a year. Long Beach has easy access to all the amenities and attractions of Los Angeles, Orange, and San Bernardino counties, including professional sporting events, music festivals, gourmet dining, film and television studios, Disneyland, and snow skiing in the local mountains.","Pediatric Cardiac Intensivist MemorialCare Miller Children’s & Women’s Hospital of Long Beach MemorialCare Medical Group Base Salary Range*: $300,000 to $310,000 *The salary range above is an estimated annual base salary for a full-time position. Your Total Rewards would include a base salary plus performance-based incentives and other valuable benefits. Our compensation models utilize fair market value data specific to your specialty. Memorial Care Medical Group (MCMG) is looking for a Pediatric Cardiac Intensivist for our dedicated Pediatric Cardiothoracic Intensive Care Unit (CTICU) at Miller Children’s & Women’s Hospital of Long Beach (MCWHLB). The new state of the art 8-bed CTICU and an additional 6-bed stepdown unit are part of our Heart Institute’s rapid growth to serve the needs of the southern California community. Candidates with strong clinical and teaching skills are encouraged to apply. The candidate should be board-certified in Pediatric Critical Care plus advanced fellowship training in Pediatric Cardiac Critical Care or a record of excellence in the clinical care of congenital cardiac patients. The successful candidate will work closely with the CTICU Medical Director Dr. Constantinos Chrysostomou and a multidisciplinary team of pediatric cardiac intensivists, cardiac surgeons, cardiologists, dedicated CTICU nurses and other specialists to further develop a state-of-the-art clinical program. Successful candidates should have (or be eligible for) an unrestricted California medical license. As part of the Memorial Care Medical Group, you will be given the tools you need to build the career you want, and the flexibility to adapt as your personal needs and professional interests change. We invite you to grow with us and help shape the future of this community. Robust compensation and benefits package are provided. Memorial Care Miller Children’s & Women’s Hospital of Long Beach, is a private, not for profit children’s hospital first opened in 1970. It is a 324 bed children’s hospital that treats more than 8,000 children each year and has become a regional pediatric destination for more than 84,000 children. It has an active perinatal and maternal fetal medicine service with over 7000 deliveries annually to the adjacent birth center and one of the largest Neonatal Intensive Care units (NICU) in the area with over 90 beds. The hospital serves as the major referral center for the over 500,000 people of Long Beach, but reaches an additional 2 million people in the immediate vicinity. The hospital has an academic affiliation with the University of California Los Angeles (UCLA) and the University of California Irvine (UCI) to which the successful candidate is eligible to apply for a faculty position. Financial & Benefits • Employed position with MemorialCare Medical Group • Competitive salary with incentive compensation • Eligible to be considered for Shareholder/Partner status with MCMG after two years of full-time employment • Full and comprehensive benefits for Physician and family • 401(k) retirement plan with employer matching • 529 College Savings Plan About Long Beach and Southern California Located on the coast of the Pacific Ocean south of Los Angeles and just west of Orange County, Long Beach is the sixth largest city in the State of California. Offering all the world class amenities of a large metropolitan city, coupled with its strong sense of community and pride, Long Beach is one of the most vibrant communities in the country. The city has been referred to as the ""Most Diverse City"" in the country by USA Today and one of the ""Best Communities for Young People"" two years in a row. With its ideal location in Southern California, year-round comfortable climate, healthy business environment and far ranging cultural pursuits, the city is alive with activity. Long Beach is home to an abundance of cultural and recreational options. Expansive beaches, three marinas, five golf courses, the Aquarium of the Pacific, the Queen Mary and the annual Grand Prix of Long Beach serve to draw 6.5 million visitors a year. Long Beach has easy access to all the amenities and attractions of Los Angeles, Orange, and San Bernardino counties, including professional sporting events, music festivals, gourmet dining, film and television studios, Disneyland, and snow skiing in the local mountains.",2026-03-25T07:11:33.781622,d58ba50261cb05c4,MemorialCare (Physician),memorialcare-phy,memorialcare-phy,,taleo
227310,357609,"Physician, Family Medicine (F/T) - Anaheim, CA",Physician Group,,,,Full-time,255000.0,270000.0,2026-03-24T00:00:00,https://memorialcare.taleo.net/careersection/phy/jobdetail.ftl?job=357609,"MemorialCare Medical Group (MCMG) has an immediate opening for a full-time Family Medicine physician at our Anaheim clinic. Practice Details · Employment opportunity with MemorialCare Medical Group · Outpatient-only practice · Daily schedule: 18-21 patients per day (average) · Office hours: 8:00 am – 5:00 pm (last patient scheduled at 4:30 pm) · Epic EMR · Urgent Care Call requirement: One (1) UC Holiday shift each year · Moonlighting opportunities · Over 40 MCMG office locations from Torrance to San Clemente · Access to MCMG specialists across 24+ specialties Financial and Benefits · Competitive base salary plus incentive opportunities · Generous Paid Time Off (PTO) benefit; accrual basis Full and comprehensive b enefits for Physician and f amily, including Medical, Dental, Vision, Life Insurance, Disability, 401(k) Retirement Plan with employer contribution, 529 College Savings Plan · Continuing medical education reimbursement fund · Medical license and DEA renewal reimbursement · Professional liability insurance · Mentoring, integration, wellness programs Shareholder/Partnership Track · Eligible to be considered for Partner/Shareholder status after two years of full-time employment · Competitive base salary plus increased incentive opportunities · Partnership stock buy- in · Leadership opportunities · Be involved in the governance of the group Base salary range: $255,000-$270,000* *The salary range above is an estimated annual base salary for a full-time position. Your Total Rewards would include a base salary plus performance-based incentives and other valuable benefits. Our compensation model utilizes fair market value data specific to your specialty.","MemorialCare Medical Group (MCMG) has an immediate opening for a full-time Family Medicine physician at our Anaheim clinic. Practice Details · Employment opportunity with MemorialCare Medical Group · Outpatient-only practice · Daily schedule: 18-21 patients per day (average) · Office hours: 8:00 am – 5:00 pm (last patient scheduled at 4:30 pm) · Epic EMR · Urgent Care Call requirement: One (1) UC Holiday shift each year · Moonlighting opportunities · Over 40 MCMG office locations from Torrance to San Clemente · Access to MCMG specialists across 24+ specialties Financial and Benefits · Competitive base salary plus incentive opportunities · Generous Paid Time Off (PTO) benefit; accrual basis Full and comprehensive b enefits for Physician and f amily, including Medical, Dental, Vision, Life Insurance, Disability, 401(k) Retirement Plan with employer contribution, 529 College Savings Plan · Continuing medical education reimbursement fund · Medical license and DEA renewal reimbursement · Professional liability insurance · Mentoring, integration, wellness programs Shareholder/Partnership Track · Eligible to be considered for Partner/Shareholder status after two years of full-time employment · Competitive base salary plus increased incentive opportunities · Partnership stock buy- in · Leadership opportunities · Be involved in the governance of the group Base salary range: $255,000-$270,000* *The salary range above is an estimated annual base salary for a full-time position. Your Total Rewards would include a base salary plus performance-based incentives and other valuable benefits. Our compensation model utilizes fair market value data specific to your specialty.",2026-03-25T07:11:33.781579,d49ff7b331018898,MemorialCare (Physician),memorialcare-phy,memorialcare-phy,,taleo
227309,357675,"Physician, Gastroenterology (Advanced Endoscopy)",Physician Group,,,,Full-time,450000.0,604529.0,2026-03-24T00:00:00,https://memorialcare.taleo.net/careersection/phy/jobdetail.ftl?job=357675,"Base Salary Range*: $450,000 to $604,529 *The salary range above is an estimated annual base salary for a full-time position. Your Total Rewards would include a base salary plus performance-based incentives and other valuable benefits. Our compensation models utilize fair market value data specific to your specialty. Position Summary MemorialCare Medical Group (MCMG) has a full-time employment opportunity for a BC/BE Gastroenterologist to be based at our Laguna Hills-MOT 680 office and Saddleback Medical Center (Orange County, California). Successful candidates will have clinical expertise and experience treating a broad range of gastrointestinal conditions as well as providing recommendations to maintain health and prevent disease. Practice Details Location: 24411 Health Center Drive Ste. 680, Laguna Hills, CA 92653 Clinic Hours: Monday to Friday, 8:00 am - 5:00 pm Hospital Call required at Saddleback Medical Center Employed position with MemorialCare Medical Group (MCMG) EMR: Epic Total Rewards Competitive compensation package Benefits to include: Medical, dental, vision, life insurance, disability, and more Professional liability insurance coverage 401k retirement plan with employer matching 529 College Savings plan Reimbursement for CME, DEA, and medical license renewals Partner/Shareholder opportunity Generous paid time off Exceptional People. Extraordinary Care. Every Time. Along with our commitment to providing extraordinary health care to our communities, we work hard to provide an exceptional working environment for our people. At our core is a dedication to the pursuit of best-practice medicine. Our physicians and staff members study the best and most effective treatments and work to implement them at all our locations. The results are outcomes that frequently exceed state and national averages. Who We Are MemorialCare Medical Group is an award-winning team of healthcare professionals dedicated to providing high quality, compassionate care to our patients. With more than 400 providers across 26 specialties, and close to 40 outpatient clinics from Torrance to San Clemente, we are honored to serve the communities within which we work and live.","Base Salary Range*: $450,000 to $604,529 *The salary range above is an estimated annual base salary for a full-time position. Your Total Rewards would include a base salary plus performance-based incentives and other valuable benefits. Our compensation models utilize fair market value data specific to your specialty. Position Summary MemorialCare Medical Group (MCMG) has a full-time employment opportunity for a BC/BE Gastroenterologist to be based at our Laguna Hills-MOT 680 office and Saddleback Medical Center (Orange County, California). Successful candidates will have clinical expertise and experience treating a broad range of gastrointestinal conditions as well as providing recommendations to maintain health and prevent disease. Practice Details Location: 24411 Health Center Drive Ste. 680, Laguna Hills, CA 92653 Clinic Hours: Monday to Friday, 8:00 am - 5:00 pm Hospital Call required at Saddleback Medical Center Employed position with MemorialCare Medical Group (MCMG) EMR: Epic Total Rewards Competitive compensation package Benefits to include: Medical, dental, vision, life insurance, disability, and more Professional liability insurance coverage 401k retirement plan with employer matching 529 College Savings plan Reimbursement for CME, DEA, and medical license renewals Partner/Shareholder opportunity Generous paid time off Exceptional People. Extraordinary Care. Every Time. Along with our commitment to providing extraordinary health care to our communities, we work hard to provide an exceptional working environment for our people. At our core is a dedication to the pursuit of best-practice medicine. Our physicians and staff members study the best and most effective treatments and work to implement them at all our locations. The results are outcomes that frequently exceed state and national averages. Who We Are MemorialCare Medical Group is an award-winning team of healthcare professionals dedicated to providing high quality, compassionate care to our patients. With more than 400 providers across 26 specialties, and close to 40 outpatient clinics from Torrance to San Clemente, we are honored to serve the communities within which we work and live.",2026-03-25T07:11:33.781527,ee06fe78e0de3249,MemorialCare (Physician),memorialcare-phy,memorialcare-phy,,taleo
